{
  "partyType": "dolor",
  "personName": "cillum ullamco",
  "id": "tempor aliqua consequat non",
  "isHighRiskOccupation": true,
  "middleName": "exercitation occaecat ea culpa",
  "secondLastName": "deserunt non sint",
  "minorCitationCount": 55963815,
  "lastName": "proident",
  "militaryStatus": "et consequat cupidatat in"
}
